item_id,acceptance_3,intensity_3,applicability_score,text_hash,text
196,1.0,1.0,1,cdfa9044f50d69d287c363c8f5643afdf947c7b766c5b05065887fc52d53e1bf,"IA e Educação - A integração da inteligência artificial na educação só será verdadeiramente eficaz quando os professores dominarem as interseções entre tecnologia, pedagogia e conteúdo Por Ana Beatriz Prudente Alckmin Leia o artigo:"
203,-1.0,1.0,1,ff726c55c129b4e2fd559098974efd0e9148cc6c1e709e2518adc90e2064d721,Contrapontos na Educação Comento sobre os riscos do uso da Inteligência Artificial na Educação. Link youtu.be/542u_6RNASQ
204,0.0,0.0,1,a7bda35b119d6ed71591c78e584497820eb56ab95c15778e584b25ecba9fbbb7,#BoletimContee | 21/02/2025 DESTAQUES | cutt.ly/destaquesCon... •Cacá Diegues: O legado imortal de um mestre do cinema brasileiro •Câmara dos Deputados debate ... inteligência artificial na educação e no trabalho •Denúncia ... contra Bolsonaro: ...defesa da democracia [+] em contee.org.br
205,1.0,1.0,1,465efac5315dc08ec088a1a02af498757767bf9a63dca18b5f6c74fbe3958f64,"Em artigo assinado pela nossa coordenadora de educação Mariana Ochs na <USER>, debatemos como o letramento em inteligência artificial pode garantir uma adoção mais ética e pedagógica dessa tecnologia. Acesse o nosso site e confira o texto completo: palavraaberta.org.br/artigo/maqui..."
210,0.0,0.0,1,9d6974e22d9ea70c36177540cb9c84703c08ceee18001acdfe34790dd1012e05,"✨19/02: Seminário: Inteligência Artificial e Educação - Desafios e Oportunidades📚🚀 Dia 19/02/2025, com transmissão online. portalnte.educacao.mg.gov.br/index.php/ho... #portalnte #nteminasgerais"
213,0.0,0.0,1,bd26063a778f3bab9f991f0d309212a2518a089ec84fcfcd6f292a5fc0ecab67,"O objetivo é discutir a relação entre inteligência artificial, a educação e o investimento dos países para o uso dessa ferramenta na formação de professores e alunos."
216,1.0,1.0,1,c34ca6409b24c9c8e4874a332718752d6dab2e260fec3ea17a22b2412383bf1a,"Na visão do vice-presidente de Transformação Digital da Ânima, a função da inteligência artificial na educação é servir como ferramenta para aproximar alunos e professores"
217,-1.0,2.0,1,b78405c975f82e68f483835ad8f4d2539393284d106e17ea5e8eea09bc44ea17,"extremamente pavoroso ver que tudo na educação agora é steam, inteligência artificial e discussões rasas e acríticas sobre mudanças climáticas"
220,1.0,1.0,1,4b19d9ed501a4fe1ee2bf04b26efc9a0a70efc87917aaaaa2098abd63414349d,"O “curso do futuro” virou realidade TECNOLOGIA + EDUCAÇÃO Parece que as prioridades mudaram. Pela primeira vez em uma universidade brasileira, o curso de Inteligência Artificial se tornou o mais concorrido, ultrapassando Medicina no SISU 2025. Nos últimos anos, a UFG — Universidade Federal de…"
221,1.0,1.0,1,3a6f62c3fcd5c34b8464a242d02db05b5cfdfe7c58e9708ec440a7e4c3df4946,Série do JN mostra como a educação pode aproveitar benefícios da inteligência artificial. O Piauí é uma das primeiras regiões em todo o continente americano a adotar o ensino de IA como uma disciplina no currículo da educação básica. Confira a reportagem completa: glo.bo/3Evwpv9
223,0.0,0.0,1,7f571723e67e6155cbcc847cb43f21eee784b377dc5aadea3b493aadc341fed1,🧪SciELO Preprints: POLÍTICAS E PRÁTICAS DA EDUCAÇÃO EM INTELIGÊNCIA ARTIFICIAL NA CHINA 🔗 doi.org/10.1590/SciE...
229,0.0,0.0,1,269491ab1fbc0580120200a6576dc6980aec7615d9b5c4160183bd3262ee5a98,Dia Internacional da Educação em 2025 é dedicado à inteligência artificial | CNN Brasil <URL> Posted into Notícias <USER>
230,0.0,0.0,1,4d899b71120d86c8cc1d6773904cbb78b9bf9c84e7509eadc6a82aecab950336,Dia Internacional da Educação em 2025 é dedicado à inteligência artificial
231,1.0,1.0,1,baf18c27e38a57981e32d8f7788adebdaf5ff9ad3a58fea1a361182ce74b5c49,"📚 Como a IA ajuda na educação? A inteligência artificial personaliza o aprendizado, criando planos de estudo adaptados às necessidades de cada aluno. 🎓🤖 Comente como você usaria IA nos estudos! 💬 … ao infinito e além… 😇😉🚀👏🏾🛸👽🖖🏾🥷🏾🙏🏾🎯🤩 bit.ly/pixelabunemat"
232,1.0,1.0,1,299d81d44b6426bfe4eebfca32a604a31da9329cd62f421ee56e6ce9bd9a27ae,"Como a Inteligência Artificial impacta a Saúde e Educação Descubra como a inteligência artificial está revolucionando setores como saúde, educação e agricultura com aplicações práticas e inovadoras."
233,0.0,0.0,1,ac5404e85a4cc7fd3b7d96c47e1b58f3d33dd2dff311761d9bbf6f84591be365,"A inteligência artificial está cada vez mais presente em diversas áreas, incluindo a educação. Esse foi o tema abordado por <USER>, no programa ""Mais Você"", na última quinta-feira (16). Confira! 🤳"
234,0.0,0.0,1,83d0a3e6648f0f5b5c912639f6fd7be6dc3d645ceb1fe1d3713a814e2b742f47,Inteligência artificial para humanidades e educação é tema de curso on-line da USP jornal.usp.br/universidade... via <USER>
238,-1.0,1.0,1,8304a7971a8df5b13696ff4dc3d5e00b0bfdb3dbf893e1e0d7ae8c118f280151,"📰Educação em pauta (2024-2025) O ano de 2024 foi de grande movimento em todo o mundo no uso da inteligência artificial na educação, enquanto, no Brasil, as escolas públicas não têm internet de alta velocidade nem professores digitalmente capacitados"
239,1.0,1.0,1,759738dc24074d24a76e83cbfcb4196befdcfbeb481acfc5e93345de4744fd01,Resumo: - Inclusão de Inteligência Artificial e literacia digital nos currículos do ensino fundamental e - Objetivo de promover inclusão tecnológica e mitigar desigualdades de acesso ao conhecimento. - Preparar estudantes para o mercado de trabalho e a sociedade digital.
240,1.0,1.0,1,8e139b8af6db2d3d56570dcc1cc56ff17895d7380a77417fd1ba9422ef6f2b58,"O ensino superior deve se reinventar para sobreviver na era da inteligência artificial. A automação inteligente alia empatia e produtividade, permitindo que profissionais foquem em tarefas estratégicas e criativas"
242,-1.0,1.0,1,66374534a99301a0375427349a5f4c66cb51a8c4668cf329aad0a712378c6788,Pesquisa mostra desafios do uso da IA no ambiente escolar. O estudo aponta desigualdades quanto à adoção da inteligência artificial entre as redes de ensino pública e privada agenciabrasil.ebc.com.br/radioagencia... via <USER>
243,1.0,1.0,1,3808723c1f7a1d0e77737c2e8552fae5346359592d2919e2603dd33ae2549804,"Vem aí o ChatGPT para professores Imagem daqui. Aparentemente revolucionária, a inteligência artificial veio para ficar. A OpenAI anuncia já o desenvolvimento de uma versão do conhecido ChatGPT especificamente destinada ao ensino, para uso de alunos e professores. O que vimos e experimentámos até…"
246,1.0,1.0,1,0596741e5044cc1e42e20cbb7933173dcf5f33011f8bc9edd8079b0817adae40,"🗞 Agência Brasília Inteligência artificial promove inclusão digital para cerca de 1,6 mil alunos da rede pública de ensino do DF"
247,1.0,1.0,1,64e2f048462d69a15be191f07179c4a4a0f2cd2b9f7f198fe22bc47d5763b6f3,5 maneiras de usar o ChatGPT na preparação para o Enem 2025 O uso do ChatGPT pode ser uma alternativa prática para estudantes que se preparam para o Exame Nacional do Ensino Médio (ENEM). A fer... #INTELIGÊNCIA #ARTIFICIAL #ChatGPT #Enem #Estudar […] [Original post on fastcompanybrasil.com]
248,1.0,1.0,1,25243d43fd7c76fb3313996fa418b6a7deaaac2b5fb772fa94041f185f77faf6,"A Inteligência Artificial leva-nos a sermos mais ambiciosos na aprendizagem. Slides de amanhã, 2025/11/05, keynote no 4.º Congresso Internacional Inovação e Tecnologia no Ensino de Línguas (iTel2025): pt.slideshare.net/slideshow/a-..."
249,1.0,1.0,1,b024436f9a594ea9445ec5c6cac259d803ee9669d3ca6b7137a79016c62114c1,8 maneiras de usar a IA para aprender idiomas de graça O aprendizado de idiomas deixou de depender exclusivamente de cursos pagos. O avanço da Inteligência Artificial (IA) democratizou o ensino ... #INTELIGÊNCIA #ARTIFICIAL #aprender #IA #idiomas […] [Original post on fastcompanybrasil.com]
250,0.0,0.0,1,9ea401714583162fcbc960a9dd45843ea5ed76c3798e85efcac57aa001e7612b,"O novo relatório do InternetLab analisa impactos da difusão da inteligência artificial — em especial, tecnologias de reconhecimento facial — nas redes públicas de ensino. 👇"
251,-1.0,1.0,1,2ffb81f0eb5cceb6a2a84fef25acb5d450ff279b759303b1b08d5f7f6fbf2b3e,"Coreia do Sul lançou programa de livros com IA para o ensino médio. Durou 4 meses… <URL> A Coreia do Sul apostou forte na inteligência artificial (IA) para revolucionar as suas salas de aula, investindo…"
254,1.0,2.0,1,110dd36bd3a7ed1015b11c49ed3d50a80417b5d699da359dea1a026bd4256f7c,✨ Transforme o Ensino com AI: O Futuro dos Professores Está Aqui! 📝 A inteligência artificial está revolucionando o aprendizado! Descubra como o investimento em treinamento de professores está melhorando a qualidade do ensino e preparando os educadores para o futuro. Clique e saiba mais sobre essa
255,0.0,0.0,1,d145586aed37712556b21cf078033d7427b1c51655113d93f807f9013598937f,Deputado do MDB propõe ensino de inteligência artificial nas escolas brasileiras – Jovem Pan <URL> Posted into Notícias […]
257,-1.0,1.0,1,f31de16be236b911393abbbcd4a1949f6e2324b35fd72979bb7faf8f5ac11ce7,"Sete em cada dez estudantes do ensino médio já usam IA para pesquisas escolares. Na nossa coluna na <USER>, falamos sobre como o aumento do uso de inteligência artificial se torna um desafio para as escolas. Leia o artigo no nosso site! Acesse: educamidia.org.br/uso-de-ia-po..."
259,0.0,0.0,1,6b6d5bd472a9f1c5ea6f2ed1d33c05d7e3f4a3c9fdb57dfba57d75c46981e919,"ESTUDO | Sete em cada dez estudantes brasileiros do ensino médio usuários da internet utilizam ferramentas de inteligência artificial (IA) generativa, como o ChatGPT e o Gemini, para realizar pesquisas escolares. Leia mais: rede98.com.br/noticias/bra..."
263,0.0,0.0,1,d501c56344c5a659ae33aa4e376fba4080fcc7b3573ad7161009dc9ecd303223,"A primeira-dama Melania Trump anunciou o desafio da Inteligência Artificial Presidencial (IA), convidando estudantes e educadores do ensino fundamental e médio em toda a América para participar. “O desafio presidencial da IA ​​será o primeiro passo na <URL>"
270,1.0,1.0,1,3be748df7b24c68f7b75e0b21582857835f2f9b6944d62d5ab8801a7fa17536b,"Em direto de Londres na RTP1 com o Ministro e a Ex-Ministra debati a minha fórmula para combater a pobreza e desigualdade e tornar 🇵🇹 um dos melhores sistemas de ensino do mundo: 1. Professores 2. Creches, sobretudo para os mais pobres 3. Tecnologia e Inteligência Artificial"
271,1.0,1.0,1,b1ad3266bb27dc33cfa9367831055994d5b0a8a6aa85746b75c874bda24983ed,"Como a Inteligência Artificial Está Redefinindo o Ensino de Ciência da Computação Com a IA ganhando espaço nas salas de aula, cursos de ciência da computação estão mudando o foco: menos código do zero, mais pensamento crítico e uso estratégico de ferramentas inteligentes. A tecnologia já virou…"
272,1.0,1.0,1,fef60f9255d73bccc5c36fc816c5352c15b52cec64cc394bf76fac1cebeae627,"Em reportagem da BBC Brasil, compartilho minhas reflexões como educadora sobre os desafios e dilemas do uso da inteligência artificial no ensino superior. Não se trata mais de decidir se vamos usar IA em sala de aula - ela já está entre nós <URL>"
273,0.0,0.0,1,bce86b31ae0738cfda7bfcb513fbffeaddc7c7f0fa4425291b8863148227ba54,"TEERÃ – A primeira fase da iniciativa Iran Digital, um programa nacional gratuito de treinamento em inteligência artificial (IA), foi lançada, visando dois milhões de estudantes do ensino fundamental e mil professores. <URL>"
275,0.0,0.0,1,2e2f8b88a2c8b4dc61bffad392432a39c8aa8d7e5d61706a359582baf59b454e,"Líder do Burkina Faso introduziu uma disciplina para alunos do ensino primário, que aprenderão codificação e IA (Inteligência Artificial) x.com/AfricanHub_/..."
276,-1.0,2.0,1,9ca7f6e926c8112078f36a0b30d97ca57ab1690ef4427208fd87cadb2844ace0,Notícia ou propaganda? Como colocar geradores de lero lero que erram informações básicas pra corrigir provas pode ser bom pro ensino? Não existe NENHUMA garantia que uma inteligência artificial consiga corrigir adequadamente uma questão discursiva.
278,0.0,0.0,1,ce663903a11af291c44bf6a892ed92889273ec172ae226fb5eeb0fd84fe7bb57,"📰 Brics firma aliança inédita para impulsionar ensino técnico-profissionalizante Acordo internacional busca ampliar qualificação de jovens, promover desenvolvimento inclusivo e enfrentar desafios comuns; inteligência artificial e avaliação do ensino superior também entram na pauta."
282,-1.0,2.0,1,4229426679908be9d65701f171afc7be6dffc3307491cee0c8e2e4e95f6fe395,MEU DEUUUUS cadê o ministério público???? Vão usar nossas crianças pra alimentar inteligência artificial de bigtech gringa e ainda causar defasagem no ensino delas
283,0.0,0.0,1,9eaa8eb4870e55e130a503184a781b43e599f21366be3e55a23006c2549a8f0e,Politécnico de Santarém promove conferência internacional sobre inteligência artificial e alianças europeias no ensino superior Leia maisribatejo.pt #InteligênciaArtificial #EducaçãoEuropeia #ConferênciaInternacional #Tecnologia #TransformaçãoDigital
285,1.0,1.0,1,0aca04c60156a5825997df0a310ea51005fbee609f8eb311c9d79d52326ebf89,Conheça inteligência artificial brasileira que ajuda a melhorar desempenho de estudantes do ensino a distância
287,1.0,1.0,1,8856ba1722e33222ba23f749a22a6b1c6c1352c37b074aa70262b21ca8742f3e,"Ensino de Inteligência Artificial nos EUA: Um Movimento em Crescimento A crescente importância da inteligência artificial (IA) na sociedade moderna está impulsionando uma transformação no sistema educacional dos Estados Unidos. Liderados por um grupo de eminentes CEOs de tecnologia, um movimento…"
288,0.0,0.0,1,b8097cebbe70d8f552e348b81373e69a9edf45d8da452ba04ccd4cd8c6372e17,Ensino de Inteligência Artificial vai ser incluído no currículo dos alunos dos Emirados Árabes Unidos desde o jardim de infância
290,-1.0,2.0,1,54491bcb9c83e9990a7e399e1b0d6704462b487b9ecd5815660d924801cd086b,"é pior do que a gente imagina! bem pior! como eu sou tonto fui dar uma olhada no perfil da moça. ela dá cursos APRENDA A CRIAR IMAGENS DO ZERO UTILIZANDO A INTELIGÊNCIA ARTIFICIAL 🫠 ""Te ensino a criar artes e ter liberdade criativa!"" 🤡"
292,0.0,1.0,1,0bcad2a14a48390416a3334154dc67d39f40fd717e60f4135e8ad783390ab8ff,Tiago Baumfeld: A inteligência artificial no ensino médico: revolução ou ameaça silenciosa? <URL>
293,-1.0,2.0,1,a97ab8f3803a95ea58e5c47e33b151e80570444744f28f7043f8e70b32e2c9d3,"assistindo um debate sobre ""inteligência artificial e futuro do ensino"" e ouvindo tanta merda saindo da boca de gente supostamente qualificada que sinceramente não sei como ainda tenho tantos problemas de autoestima"
294,1.0,1.0,1,babf39cbc435387fb0d40f9af93894e2d8ac2dca344fbac98c051c9b748f243d,OBIDOS.NET.BR - Encontro de Educadores destaca a Inteligência Artificial como aliada no ensino tinyurl.com/46tt6cs2
296,0.0,0.0,1,9d15c5bbd7c4209225513b781c62f2b9a19d0286953230cfa530f50dc5eebe3f,China inclui aulas obrigatórias de inteligência artificial desde o ensino fundamental <URL> Posted into Tecnologia <USER>
299,1.0,1.0,1,643396f4cff53d34639591c4373e6b3a1a744d443ccc6d90f443524e42812ccf,OPINIÃO RAMON FLAUBERT MACEDO | Como o Piauí se tornou referência no ensino de inteligência artificial – e o que o Tocantins pode aprender com essa experiência
300,0.0,1.0,1,d7a0b300a10e0b671f0b123dfaa24c6d6dca917c5b82932c6d8e2efcd89273c2,"O ensino brasileiro começou a incorporar inteligência artificial em suas práticas, segundo especialistas. A medida pode trazer oportunidades, mas também riscos."
301,0.0,1.0,1,1e162a08d205793b9bc031480a298b7248e3f55b0c7d8eec328702a8df11605e,"Ensino começa a integrar inteligência artificial no Brasil; especialistas veem oportunidade, mas com riscos"
303,0.0,0.0,1,b02647fb7d9a591995aafc5bc48c95ab47518a505c76d50affa5a29a8c3b23a1,"Gratuito, livro foi elaborado por pesquisadores que têm se debruçado sobre os impactos da inteligência artificial generativa (IAG) na pesquisa acadêmica e no ensino 🤖 ufpr.br/guia-inedito... #DCBR #cienciabr #AcademicSky #AcWri"
308,0.0,0.0,1,96f62a88edbfd90739770a3e035394aae3509a78b38697f13146ede4b7de36dd,Escola Municipal em Luziânia recebeu 15 computadores recondicionados do MCom e iniciará aulas de inteligência artificial em 2026. <URL>
312,0.0,0.0,1,adc3a46a07f672b7458a7dd26f5de32738ada509a06b592502f4eed0778c89e4,📈Elaboração de relatórios multidisciplinares com apoio da Inteligência Artificial é tema de curso promovido pela Escola Judicial do Amapá ↪️Saiba mais: <URL>
322,0.0,0.0,1,0a2895d07640aa815da4b029832b7bd275bec16625308152ac59f4eff0622036,Veja como funciona a escola americana que substituiu professores por inteligência artificial #Bandjornalismo ⬇️ <URL>
323,0.0,0.0,1,cada6a7c17d0fc0fde17e07795c15eed9e6653736db34a7392cad4f7abdedeaa,Escola troca professores por inteligência artificial e tem 2 horas de aula/dia share.google/kt2fgXNrPdEE...
324,0.0,0.0,1,8accbebbc62c7ca0a55a60d37244f0adb62056a6c8a15b51b699e709dbfec19b,Escola nos EUA troca professores por inteligência artificial e tem 2 horas de aula por dia; mensalidades partem de R$ 18 mil
325,0.0,0.0,1,87c06b69411e7ee0d7d66090f3f628438d7dc11396dbc311f86dc25bba37695c,"Notícia da <USER> ""Escola nos EUA não tem professores, usa inteligência artificial e aulas duram duas horas por dia"" Link sem paywall ⬇️"
331,-1.0,2.0,1,cfc4327f41dc10a621596ac56c8eedb112cb3256c5c0ae311c8a23a63ebd7f68,"Com ia e falaram q ""uma professora e seu filho do sexto ano fizeram com inteligência artificial"" vão pra bosta por isso que tá todo mundo abandonando a escola, vocês não ouvem NINGUÉM. O recreio ainda é 15 minutos oq achei péssimo. E tem um cara na minha sala a cara do salsicha de scooby doo"
332,1.0,1.0,1,7de19ae2b19801bafa37d22c784e3fd26df91317f3d2fbbac87166a2092f97df,"A inteligência artificial pode facilitar o quotidiano escolar dos professores. Na escola secundária de Hilpoltstein, os professores estão a testar... por BR em Alemanha"
334,1.0,1.0,1,7de19ae2b19801bafa37d22c784e3fd26df91317f3d2fbbac87166a2092f97df,"A inteligência artificial pode facilitar o quotidiano escolar dos professores. Na escola secundária de Hilpoltstein, os professores estão a testar... por BR em Alemanha"
337,1.0,2.0,1,a0c70280c7a0b8c4bfac8ef46defc399d31335550aa9690dad028285a98c3fdc,"Matéria legal sobre a escola com disciplina sobre Inteligência Artificial. Incrível como a IA deu um ""boom"" em poucos meses. Estamos realmente diante do futuro. #JN #JornalNacional"
339,-1.0,1.0,1,bf428701b038fabf4ae8ce0d0fc6e7b7dcefe35cfa8d52ed30f20d9fefeb7e6a,Vai chegar um momento que ficará impossível saber se um trabalho de escola foi feito por um humano ou por uma inteligência artificial imitando as letras do Humberto Gessinger.
348,1.0,1.0,1,fda872d57d0f2b1edf8cb627b64c00d9080615468784d151e9e4fa946a0b3d62,"A inteligência artificial está mudando o papel do professor, o modo de aprender e até o conceito de sala de aula. No novo artigo da Newsletter STEM Education Matters, reflito sobre como a IA está redefinindo a sala de aula com desafios, ética e muitas possibilidades. <URL>"
349,1.0,1.0,1,fd0c6ec90efe46f586528aba99bae8f3e620f060a4564838235451ce09aab980,"A inteligência artificial está redefinindo o papel do professor e o modo como aprendemos. Neste domingo, novo artigo na minha Newsletter STEAM Education Matters no #LinkedIn."
350,-1.0,2.0,1,c1b36633b246b6fb80bd377d4d2da72cea8230ab97b14819642e3582e06bb80e,"""Feliz dia do Professor"" dai tem uma foto de inteligência artificial Tipo.......... Nao existe professor? Não tem foto de nenhum professor aí? Tem que USAR A PORRA DO CHATCHUPETEX ATÉ PRA CRIAR A PORRA DE UMA FOTO DE UMA PORRA DE PROFESSOR????!?!?!??$?%*^@"
362,-1.0,1.0,1,1efe27ed55bce9e38db4a8a313f5ed49d82877103b1e86bc2706dc7beb4534ae,"E no fim, eu fui pra faculdade pra ver o professor de gestão ambiental defendendo Inteligência Artificial, achei no mínimo irônico"
365,1.0,1.0,1,b817bbf8c870a692e42828aca9b5b7cda7e078f93baba2b6f76bf6c4afc0ddd6,"Hoje de noite eu assisti uma aula online no IBMR no curso de MBA Gestão Estratégica de Projetos, o professor falando em espanhol explicando em espanhol a história da evolução da inteligência artificial no período 1940 até hoje, e sobre o Chat-GPT. Aula excelente. #inteligênciaartificial #AI #IA"
366,-1.0,2.0,1,e7240afd12fede90743a168bebeceeaa41410fdd2f718b1d1a56fc9eaded8e7e,"achei engraçado que eu fiquei horas escrevendo uma resenha, minha amg usou chatgpt no desespero e o professor na hora de corrigir colocou como observação no meu: ""uso de inteligência artificial"" e no dela não colocou nada 😭😭😭 sendo que eu literalmente FIZ o TEXTO vsfff"
372,-1.0,2.0,1,1428afb35fe2dfde936234b4ef597b6f0a7854b01a8bb2bbfa026b1b3461902b,Professor de arte apoiando arte de inteligência artificial é o cúmulo da idiotice
376,-1.0,2.0,1,300324ab2caedb477dd6669abe7f5663fcb972a7fabaf54965ce25546c8bddc5,ela fez um PODCAST com inteligência artificial algo que era só chamar mais 3 professores e fazer a porra do podcast e seria até legal ver colegas de profissão debatendo sobre os assuntos e os approaches que o livro novo tem mas God forbid pagar professor né?
392,-1.0,2.0,1,857c9591f5ecd3e5c7130737005901cb62b56f3a1263d85c0d7f15b8385099e5,"Pelo amor cara, essa reportagem sobre criança sugerirem inteligência artificial para fazer ilustração, é palhaçada kkkkkk porra que professor é esse que não incentiva as crianças a usarem a criatividade para desenhar a mão."
398,-1.0,1.0,1,58b4f14c51f74c4bc043578ea1e8eafc9160dce458560e9ecb745298efde6d8d,"na palestra de cidadania digital: “os seus alunos estão usando inteligência artificial, use você também, professor, a inteligência artificial.” não."
399,1.0,1.0,1,a4951208cb5f389926449cf56eb667731a159b6b5c1ce76262ffc9b7c68cc9a0,"Finalmente estou tendo oportunidade de ceder ao fascínio pela inteligência artificial, usando como um professor particular (obviamente checando todas as fontes ou fornecendo-as). A simplificação para assuntos complexos faz com que a economia de tempo seja algo impossível de ignorar."
401,1.0,1.0,1,2ef3044ed05f1ac40f6048e25d5834ac87be71594bd1033ce3622238f68ff65f,"O segredo de como a IA transforma a cirurgia moderna O que precisas de saber (Resumo Rápido) A Inteligência Artificial pode ajudar a formar estudantes de medicina, ao orientar na prática de técnicas cirúrgicas. A ferramenta desenvolvida na Universidade Johns Hopkins oferece feedback em tempo real,…"
406,1.0,1.0,1,9bb756ce0d4417895d86aee4c292fe17874ab6891a26d85aede3c1d70b43e763,"11 melhores plataformas de Inteligência Artificial para estudar melhor Ferramentas de Inteligência Artificial (IA) estão transformando a forma como estudantes aprendem, pesquisam e produzem cont... #INTELIGÊNCIA #ARTIFICIAL #Estudar #inteligência #artificial #Radar Origin | Interest | Match"
409,-1.0,2.0,1,3cf1cacf8954fece87c73f0e00215ff7a8d200c6ac2be20ff000663f5c1ebbe3,"Tarcínico, o canalha fascista e o povinho ignorante. A deputada estadual Professora Bebel (PT-SP), que também é segunda presidenta da APEOESP protocolou uma representação no Ministério Público de São Paulo contra o uso de inteligência artificial para vigiar estudantes em escolas estaduais..."
413,0.0,0.0,1,8b12e0e184d53f135bc89fda2d752bd99d74ea4d1163f354829d1aa767199e09,Melania Trump anuncia desafio de inteligência artificial para estudantes
417,0.0,0.0,1,448b249626b351eb4a93f3b98dbb0bef43ca7f8fde706269241d63dbbbcef6a4,Google lança Inteligência Artificial com ferramentas para estudantes. <URL>
420,1.0,1.0,1,f4a814430edb174d5f36d0608e5ba3187fff0a4bc5f29892ded21c79636f9e9c,"Nem ChatGPT, nem Gemini: essa é a melhor IA para estudar Essa inteligência artificial foi criada para estudantes, facilita leituras e não cria conteúdo genérico; conheça #Resistencia2566Dias Siga nosso BlueSky dilmaresiste"
421,1.0,1.0,1,0abc529be4dde054b542950d9a185961788f3f88df82b5ab193e2320850e08f3,"Essa inteligência artificial foi criada para estudantes, facilita leituras e não cria conteúdo genérico; conheça"
424,0.0,0.0,1,c8dda602bf9f7acb9b65483191743d09207d7887b47d1ae349f414531fa14f3f,"Google: estudantes podem ter Gemini Pro de graça Big tech está oferecendo 15 meses sem custo do pacote Google AI Pro Se você é estudante e quer utilizar os recursos de inteligência artificial (IA) do Google gratuitamente, saiba que você pode. A big tech está oferecendo 15 meses sem custo do…"
430,1.0,1.0,1,2342280f11f66e3ba6c69fa84bc85489c9ee357903bb9316ce83838233ce4dc7,"Geradores de Redação IA para Estudantes e Profissionais Neste artigo, exploraremos os principais geradores de redação com inteligência artificial, incluindo opções gratuitas e de alta performance, ideais para estudantes do Enem e profissionais que buscam eficiência na criação de textos de alta…"
431,1.0,1.0,1,6d9f015d6ecdfe492f374abab1503d99ef13da2a25b0ade2532cbe5fc5093b20,"Descomplique Sua Redação Com Inteligência Artificial Aumentar a produtividade e melhorar a qualidade dos textos escritos é um desejo comum tanto para profissionais quanto para estudantes. Com o avanço da inteligência artificial, especialmente plataformas como a Redatudo, é possível descomplicar a…"
432,1.0,1.0,1,3d5fceb554ec76e8ab69c0a69424f10afbc7ab62e1c76b5156885c41ea5c3e27,"Maximize sua Criatividade com Redatudo Online e IA Neste artigo, exploraremos como a plataforma Redatudo Online potencializa a criação de conteúdo através de inteligência artificial, facilitando a vida de criadores, profissionais de marketing e estudantes. Descubra as funcionalidades, estratégias…"
